filename,title,subject,locked
mcmc,Markov Chain Monte Carlo (MCMC), None, None
mcmc-2,Bayesian Inference MCMC (Slides), None, None
bayes-mcmc,Bayesian Inference MCMC, None, None
map, MAP Estimation, None, None
fisher, Fisher Information, None, None
pgm-improc, Graphical Image Processing, None, None
fskld, Feature Selection with KL-Divergence, None, None
white-noise, What is White Noise?, None, None
balance, Detailed Balance, None, None
fokker-planck, The Fokker-Planck Equation, None, None
select, Feature Selection, None, None
noneq-sm, Nonequilibrium Stat Mech, None, None
vae, Autoencoding Variational Bayes, None, None
pgm, Probabilistic Graphical Models, None, None
unet, Semantic Segmentation with UNET, None, None
abc, Approximate Bayesian Computation, None, None
deep-bayes, Deep Bayes, None, None
master, Master Equations, None, None
fsp, Finite State Projection, None, None
hmm, Hidden Markov Models, None, None
smloc, Single molecule localization, None, None
